examples/water_SCAN/ice04/hti_ice.json

{
    "equi_conf": "nvt_last_dump.lmp",
    "ncopies": [
        1,
        1,
        1
    ],
    "lambda_lj_on": [
        "0.000:0.100:0.0125",
        "0.100:0.200:0.025",
        "0.200:1.000:0.2",
        "1"
    ],
    "lambda_deep_on": [
        "0.0:0.1:0.025",
        "0.1:1.0:0.1125",
        "1"
    ],
    "lambda_spring_off": [
        "0.000:0.750:0.125",
        "0.750:0.875:0.0625",
        "0.875:1.000:0.03125",	
        "1"
    ],
    "protect_eps": 1e-08,
    "model": "graph.pb",
    "model_mass_map": [
        16,
        2
    ],
    "spring_k": 0.5,
    "soft_param": {
        "epsilon": 0.02,
        "sigma_oo": 3.15,
        "sigma_oh": 0.987,
        "sigma_hh": 0.987,
        "activation": 0.5,
        "n": 1.0,
        "alpha_lj": 0.5,
        "rcut": 6.0,
        "_comment": "that's all"
    },
    "crystal": "frenkel",
    "langevin": true,
    "nsteps": 200000,
    "dt": 0.0005,
    "stat_freq": 10,
    "stat_skip": 10000,
    "stat_bsize": 2000,
    "temp": 150.000000,
    "_comment": "that's all"
}

README.md

## hti.json

"0.100:0.200:0.025",
"0.200:1.000:0.2",
"1"] | the lambda value used in 00.lj_on numerial integration |
"0.05:0.15:0.02",
"0.15:0.35:0.040",
"0.35:1.00:0.065",
"1"] | the lambda value used in 01.deep_on numerial integration |
"0.750:0.900:0.050",
"0.900:0.960:0.020",
"0.960:1.00:0.010",
"1"] | the lambda value used in 02.spring_off numerial integration |
"epsilon":0.030,
"activation":0.5,
"n":1.0,
"alpha_lj":0.5,
"rcut":6.0} | see: note1 below |